{
  "$schema": "../../../schemas/public-entry.schema.json",
  "schemaVersion": 1,
  "recordType": "entry",
  "id": "career-ledger-foundation",
  "slug": "career-ledger-foundation",
  "title": "Career Ledger Foundation",
  "kind": "project",
  "status": "active",
  "period": {
    "start": "2026-08-26",
    "end": null,
    "label": "August 2026–present"
  },
  "summary": "Designed a private-first publishing system that turns local engineering evidence into reviewed, sanitized career records and a static public website.",
  "context": "Engineering work is spread across repositories, tickets, notes, and long-running initiatives. The project creates a durable career memory without making confidential source material part of the public portfolio.",
  "contributions": [
    "Defined an evidence-to-initiative workflow that separates raw activity, private analysis, sanitized candidates, and approved public records.",
    "Created repository-scoped Codex instructions and skills for project analysis, consolidation, sanitization, publication review, and site maintenance.",
    "Implemented validation, privacy auditing, incremental local Git scans, staged-file guards, static generation, and GitHub Pages deployment without runtime dependencies."
  ],
  "outcomes": [
    {
      "text": "Established a reusable offline workflow for recording engineering work while keeping publication deliberate and privacy-gated.",
      "evidenceLevel": "observed"
    }
  ],
  "areas": [
    "Developer Experience",
    "AI Engineering",
    "Product Engineering",
    "System Design"
  ],
  "technologies": [
    "Node.js",
    "Git",
    "GitHub Pages",
    "Codex",
    "JSON"
  ],
  "featured": true,
  "publication": {
    "status": "approved",
    "sanitized": true,
    "reviewedAt": "2026-08-26",
    "approvedBy": "owner"
  },
  "links": [],
  "localizations": {
    "pt-BR": {
      "title": "Fundação do Career Ledger",
      "periodLabel": "Agosto de 2026–presente",
      "summary": "Projetei um sistema de publicação que transforma evidências locais de engenharia em registros profissionais revisados e em um site estático.",
      "context": "O trabalho de engenharia fica disperso entre repositórios, tickets, anotações e iniciativas de longa duração. O projeto cria uma memória profissional durável sem transformar material confidencial em conteúdo público.",
      "contributions": [
        "Defini um fluxo de evidência até iniciativa que separa atividade bruta, análise privada, candidatos revisados e registros públicos aprovados.",
        "Criei instruções e skills do Codex específicas do repositório para análise de projetos, consolidação, sanitização, revisão de publicação e manutenção do site.",
        "Implementei validação, auditoria de privacidade, varredura incremental do Git, proteção de arquivos staged, geração estática e deploy no GitHub Pages sem dependências de runtime."
      ],
      "outcomes": [
        "Estabeleci um fluxo offline reutilizável para registrar trabalho de engenharia, mantendo a publicação deliberada e protegida por revisão."
      ],
      "links": []
    }
  }
}
