{
  "$schema": "../../../schemas/public-entry.schema.json",
  "schemaVersion": 1,
  "recordType": "entry",
  "id": "streaming-platform-foundation",
  "slug": "streaming-platform-foundation",
  "title": "Published an Evidence-Driven Streaming Platform Foundation",
  "kind": "architecture",
  "status": "completed",
  "period": {
    "start": "2026-08-26",
    "end": "2026-08-26",
    "label": "August 2026"
  },
  "summary": "Designed a rights-aware streaming platform architecture and turned repository governance, runtime boundaries, and verification expectations into executable foundations.",
  "context": "The project deliberately separates target architecture from implemented evidence. This candidate covers the published architecture, repository controls, and bounded runtime foundation without implying a playable or hosted product.",
  "contributions": [
    "Defined product requirements, bounded contexts, data ownership, federated API boundaries, event integration, media rights, resilience, and phased delivery criteria.",
    "Established repository governance with hosted CI, security checks, branch controls, contribution policy, and evidence-oriented documentation.",
    "Implemented guarded local data services, fail-fast configuration, redacted structured logging, an HTTP adapter, and deterministic service lifecycle handling.",
    "Kept planned capabilities, retained branch evidence, and implemented runtime checkpoints explicitly separated."
  ],
  "outcomes": [
    {
      "text": "Published a reviewable repository foundation with automated quality, security, and governance evidence.",
      "evidenceLevel": "public"
    }
  ],
  "areas": [
    "System Design",
    "Backend Architecture",
    "Cloud & Infrastructure",
    "Observability & Reliability",
    "Authentication & Security"
  ],
  "technologies": [
    "TypeScript",
    "Next.js",
    "PostgreSQL",
    "Redis",
    "OpenTelemetry",
    "GitHub Actions"
  ],
  "featured": false,
  "significance": "milestone",
  "activityTypes": [
    "architecture",
    "planning",
    "implementation",
    "security",
    "testing",
    "infrastructure",
    "observability",
    "documentation"
  ],
  "publication": {
    "status": "approved",
    "sanitized": true,
    "reviewedAt": "2026-08-28",
    "approvedBy": "owner"
  },
  "links": []
}
